{"$schema":"https://json-schema.org/draft/2020-12/schema","items":{"additionalProperties":true,"properties":{"address":{"type":"string"},"lat":{"type":["number","null"]},"lng":{"type":["number","null"]},"mpir":{"type":["number","null"]},"name":{"type":"string"},"postcode":{"type":["string","number"]},"price_per_day":{"type":["number","null"]},"provider_id":{"type":"string"},"rad":{"type":["number","null"]},"star_clinical":{"type":["number","null"]},"star_compliance":{"type":["number","null"]},"star_overall":{"type":["number","null"]},"suburb":{"type":"string"},"tags":{"items":{"type":"string"},"type":"array"}},"required":["provider_id","name","postcode"],"type":"object"},"title":"providers","type":"array"}